{
  "$schema": "https://json-schema.org/draft/2020-12/schema",
  "$id": "https://ponta0321.github.io/game-achievement-common-spec/v1.0.0/export.schema.json",
  "title": "Export",
  "description": "Game Achievement Common Spec v1.0.0 — Export envelope. Top-level structure for user data export.",
  "type": "object",
  "required": [
    "schema_version",
    "source_site",
    "exported_at",
    "user_achievements"
  ],
  "properties": {
    "schema_version": {
      "type": "string",
      "const": "1.0.0"
    },
    "source_site": {
      "type": "string",
      "format": "uri",
      "description": "URL of the site that produced this export."
    },
    "exported_at": {
      "type": "string",
      "format": "date-time",
      "description": "Timestamp when this export file was generated (ISO 8601)."
    },
    "user_achievements": {
      "type": "array",
      "description": "Array of UserAchievement records. See user_achievement.schema.json.",
      "items": {
        "$ref": "user_achievement.schema.json"
      }
    }
  },
  "additionalProperties": false
}
